title,url,description,tags
"What is Web Application Firewall?","https://docs.fortinet.com/document/fortiweb/8.0.0/waf-concept-guide/542417/what-is-web-application-firewall","Conceptual overview of WAFs and how FortiWeb protects web applications using application-layer inspection and advanced techniques.","fortinet;fortiweb;waf;web application firewall;application security;http;https;layer7;concepts"
"What is FortiWeb Web Application Firewall (WAF) architecture?","https://docs.fortinet.com/document/fortiweb/8.0.0/network-architecture-guide/320043/what-is-fortiweb-web-application-firewall-waf-architecture","High-level guide describing FortiWeb deployment modes, HA options, and how WAF fits into an organization's architecture.","fortinet;fortiweb;waf;architecture;deployment modes;reverse proxy;transparent mode;high availability;network design"
"FortiWeb WAF Feature Overview Guide","https://docs.fortinet.com/document/fortiweb/8.0.0/fortiweb-waf-feature-overview-guide","Feature overview document listing key FortiWeb capabilities for web application and API protection.","fortinet;fortiweb;waf;features;signatures;machine learning;api protection;bot mitigation;ddos;virtual patching"
"FortiWeb Administration Guide – Introduction (8.0.5)","https://docs.fortinet.com/document/fortiweb/8.0.5/administration-guide/60895/introduction","Intro to FortiWeb administration covering major security functions, supported platforms, and deployment benefits.","fortinet;fortiweb;administration;configuration;waf policies;logging;fortiguard;deployment;operations"
"WAF solutions against OWASP Top 10 risks","https://docs.fortinet.com/document/fortiweb/8.0.0/waf-solutions-against-owasp-top-10-risks/801792/waf-solutions-against-owasp-top-10-risks","Explains how FortiWeb mitigates classical OWASP Top 10 web application risks using WAF policies and signatures.","fortinet;fortiweb;owasp top10;web vulnerabilities;sql injection;xss;broken access control;security misconfiguration;input validation"
"WAF solutions against OWASP Top 10 API security risks","https://docs.fortinet.com/document/fortiweb/8.0.0/waf-solutions-against-owasp-top-10-api-security-risks/22682/waf-solutions-against-owasp-top-10-api-security-risks","Describes FortiWeb controls for the OWASP Top 10 API risks, including abuse detection and API-specific protections.","fortinet;fortiweb;owasp api top10;api security;rate limiting;abuse detection;authorization;input validation"
"WAF solutions against 
